<?xml version="1.0" encoding="UTF-8"?>
<lyrics xmlns="http://www.github.com/cqjjjzr/LyricsXML"
		xmlns:xsi="http://www.w3.org/2001/XMLSchema-instance"
		xsi:schemaLocation="http://www.github.com/cqjjjzr/EnhancedLyrics LXML_0.0.1.xsd">
	<title>千ノ縁</title>
	<artist>Yonder Voice</artist>
	<artist>瑶山百霊</artist>
	<album>千ノ縁</album>
	<lang>jp_JP</lang>
	<offsetMs>5</offsetMs>
	<lines>
		<line timeMs="500">
			<time>0,0,0;1,150,225;2,250,300;3,350,300;4,400,500;</time>
			<translation lang="zh_CN">夜樱烂漫</translation>
		</line>
	</lines>
</lyrics>