<?xml version="1.0" encoding="UTF-8"?>
<lyrics xmlns="http://www.github.com/cqjjjzr/LyricsXML"
		xmlns:xsi="http://www.w3.org/2001/XMLSchema-instance"
		xsi:schemaLocation="http://www.github.com/cqjjjzr/LyricsXML LXML_0.0.1.xsd">
	<title>千ノ縁</title>
	<artist>Yonder Voice</artist>
	<artist>瑶山百霊</artist>
	<album>千ノ縁</album>
	<lang>jp</lang>
	<offsetMs>5</offsetMs>
	<lines>
		<line timeMs="500">
			<text><ruby v="そら">空</ruby>に<ruby v="む">向</ruby>かう</text>
			<time>aaaaaaaaaaaaaaaaaaaaaaaaaaaaaaaaaa</time>
			<translation lang="zh">夜樱烂漫</translation>
		</line>
	</lines>
</lyrics>